{
 "schema": "velorona.parity-fixture/1",
 "id": "ca-clear",
 "tags": [
  "clear"
 ],
 "note": "Estevan->Midale SK, 38 km, mid frequency",
 "selection": {
  "rule": "see parity/README.md#how-links-were-chosen",
  "pack": "ca-ised-fixed",
  "snapshot_sha256": "f9daa05e51a38a8083d50513d63c7c173caa1ffd5257011af54aed11ce1387c8",
  "link_id": "010029391-004",
  "licensee": "Rogers Communications Canada Inc.",
  "published_frequencies_mhz": [
   5945.2,
   5974.85,
   6197.24,
   6226.89
  ]
 },
 "link": {
  "site_a": {
   "id": "ised-fixed-49.16072,-102.98145",
   "lat": 49.16072,
   "lon": -102.98145,
   "height_m": 30.0,
   "height_origin": "Assumed",
   "description": "ESTEVAN, SASKATCHEWAN"
  },
  "site_b": {
   "id": "ised-fixed-49.37808,-103.38661",
   "lat": 49.37808,
   "lon": -103.38661,
   "height_m": 30.0,
   "height_origin": "Assumed",
   "description": "MIDALE, SASKATCHEWAN"
  },
  "frequency_ghz": 6.22689,
  "frequency_origin": "Observed",
  "polarization": "V",
  "polarization_origin": "Assumed",
  "fade_margin_db": 32.0,
  "fade_margin_origin": "Assumed"
 },
 "terrain": {
  "mode": "samples",
  "source": "SYNTHETIC: 100 m flat + triangular hump",
  "hump_m": 19.634,
  "target_percent_fresnel_clear": 1.5,
  "samples": [
   [
    49.16072,
    -102.98145,
    100.0
   ],
   [
    49.165170042,
    -102.989682942,
    100.801388
   ],
   [
    49.169619498,
    -102.997917364,
    101.602776
   ],
   [
    49.174068368,
    -103.006153266,
    102.404163
   ],
   [
    49.178516653,
    -103.014390649,
    103.205551
   ],
   [
    49.182964352,
    -103.022629512,
    104.006939
   ],
   [
    49.187411465,
    -103.030869857,
    104.808327
   ],
   [
    49.191857991,
    -103.039111682,
    105.609714
   ],
   [
    49.196303931,
    -103.04735499,
    106.411102
   ],
   [
    49.200749284,
    -103.055599779,
    107.21249
   ],
   [
    49.205194051,
    -103.06384605,
    108.013878
   ],
   [
    49.20963823,
    -103.072093804,
    108.815265
   ],
   [
    49.214081821,
    -103.080343041,
    109.616653
   ],
   [
    49.218524825,
    -103.088593761,
    110.418041
   ],
   [
    49.222967242,
    -103.096845964,
    111.219429
   ],
   [
    49.22740907,
    -103.105099651,
    112.020816
   ],
   [
    49.231850311,
    -103.113354822,
    112.822204
   ],
   [
    49.236290963,
    -103.121611478,
    113.623592
   ],
   [
    49.240731026,
    -103.129869618,
    114.42498
   ],
   [
    49.245170501,
    -103.138129243,
    115.226367
   ],
   [
    49.249609387,
    -103.146390353,
    116.027755
   ],
   [
    49.254047683,
    -103.154652949,
    116.829143
   ],
   [
    49.258485391,
    -103.162917031,
    117.630531
   ],
   [
    49.262922509,
    -103.171182599,
    118.431918
   ],
   [
    49.267359037,
    -103.179449653,
    119.233306
   ],
   [
    49.271794975,
    -103.187718195,
    119.233306
   ],
   [
    49.276230323,
    -103.195988223,
    118.431918
   ],
   [
    49.280665081,
    -103.204259738,
    117.630531
   ],
   [
    49.285099248,
    -103.212532742,
    116.829143
   ],
   [
    49.289532825,
    -103.220807233,
    116.027755
   ],
   [
    49.29396581,
    -103.229083213,
    115.226367
   ],
   [
    49.298398205,
    -103.237360681,
    114.42498
   ],
   [
    49.302830008,
    -103.245639638,
    113.623592
   ],
   [
    49.30726122,
    -103.253920084,
    112.822204
   ],
   [
    49.31169184,
    -103.26220202,
    112.020816
   ],
   [
    49.316121868,
    -103.270485445,
    111.219429
   ],
   [
    49.320551304,
    -103.278770361,
    110.418041
   ],
   [
    49.324980148,
    -103.287056767,
    109.616653
   ],
   [
    49.329408399,
    -103.295344664,
    108.815265
   ],
   [
    49.333836057,
    -103.303634051,
    108.013878
   ],
   [
    49.338263123,
    -103.31192493,
    107.21249
   ],
   [
    49.342689595,
    -103.320217301,
    106.411102
   ],
   [
    49.347115475,
    -103.328511164,
    105.609714
   ],
   [
    49.35154076,
    -103.336806518,
    104.808327
   ],
   [
    49.355965452,
    -103.345103366,
    104.006939
   ],
   [
    49.360389551,
    -103.353401706,
    103.205551
   ],
   [
    49.364813055,
    -103.361701539,
    102.404163
   ],
   [
    49.369235964,
    -103.370002865,
    101.602776
   ],
   [
    49.373658279,
    -103.378305686,
    100.801388
   ],
   [
    49.37808,
    -103.38661,
    100.0
   ]
  ]
 },
 "weather": {
  "mode": "snapshot",
  "source": "SYNTHETIC raw Open-Meteo `current` object (units: mm per `interval` s; snowfall cm)",
  "sites": {
   "A": {
    "open_meteo_current": {
     "time": "2026-10-07T15:45",
     "interval": 900,
     "temperature_2m": 8.0,
     "wind_speed_10m": 12.0,
     "precipitation": 0.0,
     "rain": 0.0,
     "showers": 0.0,
     "snowfall": 0.0,
     "weather_code": 1
    }
   },
   "B": {
    "open_meteo_current": {
     "time": "2026-10-07T15:45",
     "interval": 900,
     "temperature_2m": 8.0,
     "wind_speed_10m": 12.0,
     "precipitation": 0.0,
     "rain": 0.0,
     "showers": 0.0,
     "snowfall": 0.0,
     "weather_code": 1
    }
   }
  }
 },
 "synthetic": [
  "fade_margin_db",
  "polarization",
  "terrain",
  "weather"
 ]
}