{
 "schema": "velorona.parity-fixture/1",
 "id": "ca-mixed",
 "tags": [
  "mixed",
  "D1"
 ],
 "note": "rain 1 + showers 2 + snow 0.1 mm w.e.",
 "selection": {
  "rule": "see parity/README.md#how-links-were-chosen",
  "pack": "ca-ised-fixed",
  "snapshot_sha256": "f9daa05e51a38a8083d50513d63c7c173caa1ffd5257011af54aed11ce1387c8",
  "link_id": "011073727-002",
  "licensee": "ROYAL UNIVERSITY HOSPITAL FES MAINTENANCE",
  "published_frequencies_mhz": [
   75750.0,
   85750.0
  ]
 },
 "link": {
  "site_a": {
   "id": "ised-fixed-52.12717,-106.69613",
   "lat": 52.12717,
   "lon": -106.69613,
   "height_m": 30.0,
   "height_origin": "Assumed",
   "description": "St. Pauls"
  },
  "site_b": {
   "id": "ised-fixed-52.12800,-106.72972",
   "lat": 52.128,
   "lon": -106.72972,
   "height_m": 30.0,
   "height_origin": "Assumed",
   "description": "Parkridge"
  },
  "frequency_ghz": 85.75,
  "frequency_origin": "Observed",
  "polarization": "V",
  "polarization_origin": "Assumed",
  "fade_margin_db": 6.3333,
  "fade_margin_origin": "Assumed"
 },
 "terrain": {
  "mode": "samples",
  "source": "SYNTHETIC: 100 m flat + triangular hump",
  "hump_m": 28.538,
  "target_percent_fresnel_clear": 1.5,
  "samples": [
   [
    52.12717,
    -106.69613,
    100.0
   ],
   [
    52.127187034,
    -106.696815498,
    101.164816
   ],
   [
    52.127204064,
    -106.697500996,
    102.329633
   ],
   [
    52.127221091,
    -106.698186495,
    103.494449
   ],
   [
    52.127238113,
    -106.698871994,
    104.659265
   ],
   [
    52.127255131,
    -106.699557494,
    105.824082
   ],
   [
    52.127272145,
    -106.700242994,
    106.988898
   ],
   [
    52.127289156,
    -106.700928495,
    108.153714
   ],
   [
    52.127306162,
    -106.701613996,
    109.318531
   ],
   [
    52.127323164,
    -106.702299498,
    110.483347
   ],
   [
    52.127340163,
    -106.702985,
    111.648163
   ],
   [
    52.127357157,
    -106.703670503,
    112.81298
   ],
   [
    52.127374148,
    -106.704356007,
    113.977796
   ],
   [
    52.127391134,
    -106.705041511,
    115.142612
   ],
   [
    52.127408117,
    -106.705727015,
    116.307429
   ],
   [
    52.127425095,
    -106.70641252,
    117.472245
   ],
   [
    52.12744207,
    -106.707098026,
    118.637061
   ],
   [
    52.12745904,
    -106.707783532,
    119.801878
   ],
   [
    52.127476007,
    -106.708469038,
    120.966694
   ],
   [
    52.127492969,
    -106.709154545,
    122.13151
   ],
   [
    52.127509928,
    -106.709840053,
    123.296327
   ],
   [
    52.127526883,
    -106.710525561,
    124.461143
   ],
   [
    52.127543834,
    -106.71121107,
    125.625959
   ],
   [
    52.12756078,
    -106.711896579,
    126.790776
   ],
   [
    52.127577723,
    -106.712582089,
    127.955592
   ],
   [
    52.127594662,
    -106.713267599,
    127.955592
   ],
   [
    52.127611597,
    -106.713953109,
    126.790776
   ],
   [
    52.127628527,
    -106.714638621,
    125.625959
   ],
   [
    52.127645454,
    -106.715324133,
    124.461143
   ],
   [
    52.127662377,
    -106.716009645,
    123.296327
   ],
   [
    52.127679296,
    -106.716695158,
    122.13151
   ],
   [
    52.127696211,
    -106.717380671,
    120.966694
   ],
   [
    52.127713122,
    -106.718066185,
    119.801878
   ],
   [
    52.127730029,
    -106.718751699,
    118.637061
   ],
   [
    52.127746932,
    -106.719437214,
    117.472245
   ],
   [
    52.127763831,
    -106.72012273,
    116.307429
   ],
   [
    52.127780726,
    -106.720808245,
    115.142612
   ],
   [
    52.127797617,
    -106.721493762,
    113.977796
   ],
   [
    52.127814504,
    -106.722179279,
    112.81298
   ],
   [
    52.127831387,
    -106.722864796,
    111.648163
   ],
   [
    52.127848266,
    -106.723550314,
    110.483347
   ],
   [
    52.127865142,
    -106.724235833,
    109.318531
   ],
   [
    52.127882013,
    -106.724921352,
    108.153714
   ],
   [
    52.12789888,
    -106.725606872,
    106.988898
   ],
   [
    52.127915743,
    -106.726292392,
    105.824082
   ],
   [
    52.127932603,
    -106.726977912,
    104.659265
   ],
   [
    52.127949458,
    -106.727663433,
    103.494449
   ],
   [
    52.127966309,
    -106.728348955,
    102.329633
   ],
   [
    52.127983157,
    -106.729034477,
    101.164816
   ],
   [
    52.128,
    -106.72972,
    100.0
   ]
  ]
 },
 "weather": {
  "mode": "snapshot",
  "source": "SYNTHETIC raw Open-Meteo `current` object (units: mm per `interval` s; snowfall cm)",
  "sites": {
   "A": {
    "open_meteo_current": {
     "time": "2026-10-07T15:45",
     "interval": 900,
     "temperature_2m": 8.0,
     "wind_speed_10m": 12.0,
     "precipitation": 3.1,
     "rain": 1.0,
     "showers": 2.0,
     "snowfall": 0.7,
     "weather_code": 63
    }
   },
   "B": {
    "open_meteo_current": {
     "time": "2026-10-07T15:45",
     "interval": 900,
     "temperature_2m": 8.0,
     "wind_speed_10m": 12.0,
     "precipitation": 3.1,
     "rain": 1.0,
     "showers": 2.0,
     "snowfall": 0.7,
     "weather_code": 63
    }
   }
  }
 },
 "synthetic": [
  "fade_margin_calibrated",
  "fade_margin_db",
  "polarization",
  "terrain",
  "weather"
 ]
}