{
 "schema": "velorona.parity-fixture/1",
 "id": "ca-marginal",
 "tags": [
  "marginal"
 ],
 "note": "Goupil->Les Mechins QC",
 "selection": {
  "rule": "see parity/README.md#how-links-were-chosen",
  "pack": "ca-ised-fixed",
  "snapshot_sha256": "f9daa05e51a38a8083d50513d63c7c173caa1ffd5257011af54aed11ce1387c8",
  "link_id": "010041541-002",
  "licensee": "Gouvernement du Qu\u00e9bec (MCN) - Micro-Ondes RENIR",
  "published_frequencies_mhz": [
   6152.75,
   6404.79
  ]
 },
 "link": {
  "site_a": {
   "id": "ised-fixed-48.68972,-67.32611",
   "lat": 48.68972,
   "lon": -67.32611,
   "height_m": 30.0,
   "height_origin": "Assumed",
   "description": "Goupil, QC"
  },
  "site_b": {
   "id": "ised-fixed-48.96250,-67.01222",
   "lat": 48.9625,
   "lon": -67.01222,
   "height_m": 30.0,
   "height_origin": "Assumed",
   "description": "Les M\u00e9chins, QC"
  },
  "frequency_ghz": 6.40479,
  "frequency_origin": "Observed",
  "polarization": "V",
  "polarization_origin": "Assumed",
  "fade_margin_db": 32.0,
  "fade_margin_origin": "Assumed"
 },
 "terrain": {
  "mode": "samples",
  "source": "SYNTHETIC: 100 m flat + triangular hump",
  "hump_m": 42.684,
  "target_percent_fresnel_clear": 0.45,
  "samples": [
   [
    48.68972,
    -67.32611,
    100.0
   ],
   [
    48.695295429,
    -67.319738145,
    101.742204
   ],
   [
    48.700870506,
    -67.313364879,
    103.484408
   ],
   [
    48.706445232,
    -67.306990201,
    105.226612
   ],
   [
    48.712019606,
    -67.30061411,
    106.968816
   ],
   [
    48.717593628,
    -67.294236606,
    108.71102
   ],
   [
    48.723167299,
    -67.287857689,
    110.453224
   ],
   [
    48.728740617,
    -67.281477358,
    112.195429
   ],
   [
    48.734313582,
    -67.275095613,
    113.937633
   ],
   [
    48.739886196,
    -67.268712452,
    115.679837
   ],
   [
    48.745458456,
    -67.262327876,
    117.422041
   ],
   [
    48.751030364,
    -67.255941885,
    119.164245
   ],
   [
    48.756601919,
    -67.249554476,
    120.906449
   ],
   [
    48.762173121,
    -67.243165651,
    122.648653
   ],
   [
    48.76774397,
    -67.236775408,
    124.390857
   ],
   [
    48.773314465,
    -67.230383748,
    126.133061
   ],
   [
    48.778884607,
    -67.223990669,
    127.875265
   ],
   [
    48.784454395,
    -67.217596171,
    129.617469
   ],
   [
    48.790023829,
    -67.211200253,
    131.359673
   ],
   [
    48.79559291,
    -67.204802916,
    133.101878
   ],
   [
    48.801161636,
    -67.198404158,
    134.844082
   ],
   [
    48.806730008,
    -67.192003979,
    136.586286
   ],
   [
    48.812298026,
    -67.185602378,
    138.32849
   ],
   [
    48.817865689,
    -67.179199356,
    140.070694
   ],
   [
    48.823432997,
    -67.172794911,
    141.812898
   ],
   [
    48.828999951,
    -67.166389043,
    141.812898
   ],
   [
    48.834566549,
    -67.159981752,
    140.070694
   ],
   [
    48.840132793,
    -67.153573036,
    138.32849
   ],
   [
    48.845698681,
    -67.147162896,
    136.586286
   ],
   [
    48.851264214,
    -67.140751331,
    134.844082
   ],
   [
    48.856829391,
    -67.134338341,
    133.101878
   ],
   [
    48.862394213,
    -67.127923924,
    131.359673
   ],
   [
    48.867958678,
    -67.121508081,
    129.617469
   ],
   [
    48.873522788,
    -67.115090811,
    127.875265
   ],
   [
    48.879086541,
    -67.108672114,
    126.133061
   ],
   [
    48.884649938,
    -67.102251988,
    124.390857
   ],
   [
    48.890212979,
    -67.095830434,
    122.648653
   ],
   [
    48.895775663,
    -67.089407451,
    120.906449
   ],
   [
    48.90133799,
    -67.082983038,
    119.164245
   ],
   [
    48.906899961,
    -67.076557195,
    117.422041
   ],
   [
    48.912461574,
    -67.070129921,
    115.679837
   ],
   [
    48.91802283,
    -67.063701217,
    113.937633
   ],
   [
    48.923583728,
    -67.057271081,
    112.195429
   ],
   [
    48.92914427,
    -67.050839512,
    110.453224
   ],
   [
    48.934704453,
    -67.044406511,
    108.71102
   ],
   [
    48.940264279,
    -67.037972077,
    106.968816
   ],
   [
    48.945823746,
    -67.03153621,
    105.226612
   ],
   [
    48.951382856,
    -67.025098908,
    103.484408
   ],
   [
    48.956941607,
    -67.018660172,
    101.742204
   ],
   [
    48.9625,
    -67.01222,
    100.0
   ]
  ]
 },
 "weather": {
  "mode": "snapshot",
  "source": "SYNTHETIC raw Open-Meteo `current` object (units: mm per `interval` s; snowfall cm)",
  "sites": {
   "A": {
    "open_meteo_current": {
     "time": "2026-10-07T15:45",
     "interval": 900,
     "temperature_2m": 8.0,
     "wind_speed_10m": 12.0,
     "precipitation": 0.0,
     "rain": 0.0,
     "showers": 0.0,
     "snowfall": 0.0,
     "weather_code": 1
    }
   },
   "B": {
    "open_meteo_current": {
     "time": "2026-10-07T15:45",
     "interval": 900,
     "temperature_2m": 8.0,
     "wind_speed_10m": 12.0,
     "precipitation": 0.0,
     "rain": 0.0,
     "showers": 0.0,
     "snowfall": 0.0,
     "weather_code": 1
    }
   }
  }
 },
 "synthetic": [
  "fade_margin_db",
  "polarization",
  "terrain",
  "weather"
 ]
}