{
 "schema": "velorona.parity-fixture/1",
 "id": "ca-subghz-dry",
 "tags": [
  "no-data",
  "T2",
  "frequency-range"
 ],
 "note": "REAL link 010807806-001 (Bowmanton -> Chappice Lake AB, 0.94 GHz published) with dry weather; terrain is the ca-clear profile re-pointed (SYNTHETIC)",
 "selection": {
  "rule": "see parity/README.md#how-links-were-chosen",
  "pack": "ca-ised-fixed",
  "snapshot_sha256": "f9daa05e51a38a8083d50513d63c7c173caa1ffd5257011af54aed11ce1387c8",
  "link_id": "010807806-001",
  "licensee": "AltaLink",
  "published_frequencies_mhz": [
   932.53125,
   941.53125
  ]
 },
 "link": {
  "site_a": {
   "id": "ised-fixed-50.17897,-110.48103",
   "lat": 50.17897,
   "lon": -110.48103,
   "height_m": 30.0,
   "height_origin": "Assumed",
   "description": "Bowmanton AB 9244R"
  },
  "site_b": {
   "id": "ised-fixed-50.18014,-110.48117",
   "lat": 50.18014,
   "lon": -110.48117,
   "height_m": 30.0,
   "height_origin": "Assumed",
   "description": "Chappice Lake AB 649S"
  },
  "frequency_ghz": 0.94153125,
  "frequency_origin": "Observed",
  "polarization": "V",
  "polarization_origin": "Assumed",
  "fade_margin_db": 32.0,
  "fade_margin_origin": "Assumed"
 },
 "terrain": {
  "mode": "samples",
  "source": "SYNTHETIC: flat 100 m; points linearly interpolated (0.1 km path)",
  "hump_m": 19.634,
  "target_percent_fresnel_clear": 1.5,
  "samples": [
   [
    50.17897,
    -110.48103,
    100.0
   ],
   [
    50.17899387755102,
    -110.48103285714286,
    100.0
   ],
   [
    50.17901775510204,
    -110.48103571428572,
    100.0
   ],
   [
    50.17904163265306,
    -110.48103857142857,
    100.0
   ],
   [
    50.17906551020408,
    -110.48104142857143,
    100.0
   ],
   [
    50.1790893877551,
    -110.48104428571429,
    100.0
   ],
   [
    50.17911326530612,
    -110.48104714285715,
    100.0
   ],
   [
    50.179137142857144,
    -110.48105000000001,
    100.0
   ],
   [
    50.179161020408166,
    -110.48105285714286,
    100.0
   ],
   [
    50.17918489795918,
    -110.48105571428572,
    100.0
   ],
   [
    50.179208775510205,
    -110.48105857142858,
    100.0
   ],
   [
    50.17923265306123,
    -110.48106142857144,
    100.0
   ],
   [
    50.17925653061224,
    -110.4810642857143,
    100.0
   ],
   [
    50.179280408163265,
    -110.48106714285714,
    100.0
   ],
   [
    50.17930428571429,
    -110.48107,
    100.0
   ],
   [
    50.1793281632653,
    -110.48107285714286,
    100.0
   ],
   [
    50.179352040816326,
    -110.48107571428572,
    100.0
   ],
   [
    50.17937591836735,
    -110.48107857142858,
    100.0
   ],
   [
    50.179399795918364,
    -110.48108142857143,
    100.0
   ],
   [
    50.17942367346939,
    -110.48108428571429,
    100.0
   ],
   [
    50.17944755102041,
    -110.48108714285715,
    100.0
   ],
   [
    50.17947142857143,
    -110.48109000000001,
    100.0
   ],
   [
    50.17949530612245,
    -110.48109285714287,
    100.0
   ],
   [
    50.17951918367347,
    -110.48109571428571,
    100.0
   ],
   [
    50.17954306122449,
    -110.48109857142857,
    100.0
   ],
   [
    50.17956693877551,
    -110.48110142857144,
    100.0
   ],
   [
    50.17959081632653,
    -110.4811042857143,
    100.0
   ],
   [
    50.179614693877554,
    -110.48110714285714,
    100.0
   ],
   [
    50.17963857142857,
    -110.48111,
    100.0
   ],
   [
    50.17966244897959,
    -110.48111285714286,
    100.0
   ],
   [
    50.179686326530614,
    -110.48111571428572,
    100.0
   ],
   [
    50.17971020408164,
    -110.48111857142858,
    100.0
   ],
   [
    50.17973408163265,
    -110.48112142857143,
    100.0
   ],
   [
    50.179757959183675,
    -110.48112428571429,
    100.0
   ],
   [
    50.1797818367347,
    -110.48112714285715,
    100.0
   ],
   [
    50.17980571428571,
    -110.48113000000001,
    100.0
   ],
   [
    50.179829591836736,
    -110.48113285714287,
    100.0
   ],
   [
    50.17985346938776,
    -110.48113571428571,
    100.0
   ],
   [
    50.179877346938774,
    -110.48113857142857,
    100.0
   ],
   [
    50.1799012244898,
    -110.48114142857143,
    100.0
   ],
   [
    50.17992510204082,
    -110.4811442857143,
    100.0
   ],
   [
    50.179948979591835,
    -110.48114714285715,
    100.0
   ],
   [
    50.17997285714286,
    -110.48115,
    100.0
   ],
   [
    50.17999673469388,
    -110.48115285714286,
    100.0
   ],
   [
    50.1800206122449,
    -110.48115571428572,
    100.0
   ],
   [
    50.18004448979592,
    -110.48115857142858,
    100.0
   ],
   [
    50.18006836734694,
    -110.48116142857144,
    100.0
   ],
   [
    50.18009224489796,
    -110.48116428571429,
    100.0
   ],
   [
    50.18011612244898,
    -110.48116714285715,
    100.0
   ],
   [
    50.18014,
    -110.48117,
    100.0
   ]
  ]
 },
 "weather": {
  "mode": "snapshot",
  "source": "SYNTHETIC raw Open-Meteo `current` object (units: mm per `interval` s; snowfall cm)",
  "sites": {
   "A": {
    "open_meteo_current": {
     "time": "2026-10-07T15:45",
     "interval": 900,
     "temperature_2m": 8.0,
     "wind_speed_10m": 12.0,
     "precipitation": 0.0,
     "rain": 0.0,
     "showers": 0.0,
     "snowfall": 0.0,
     "weather_code": 1
    }
   },
   "B": {
    "open_meteo_current": {
     "time": "2026-10-07T15:45",
     "interval": 900,
     "temperature_2m": 8.0,
     "wind_speed_10m": 12.0,
     "precipitation": 0.0,
     "rain": 0.0,
     "showers": 0.0,
     "snowfall": 0.0,
     "weather_code": 1
    }
   }
  }
 },
 "synthetic": [
  "fade_margin_db",
  "polarization",
  "terrain",
  "weather"
 ]
}