{
 "schema": "velorona.parity-fixture/1",
 "id": "ca-short",
 "tags": [
  "short"
 ],
 "note": "Grand Rapids MB, 0.6 km",
 "selection": {
  "rule": "see parity/README.md#how-links-were-chosen",
  "pack": "ca-ised-fixed",
  "snapshot_sha256": "f9daa05e51a38a8083d50513d63c7c173caa1ffd5257011af54aed11ce1387c8",
  "link_id": "010028065-001",
  "licensee": "Manitoba Hydro (Microwave Radio)",
  "published_frequencies_mhz": [
   7570.0,
   7720.0
  ]
 },
 "link": {
  "site_a": {
   "id": "ised-fixed-53.15889,-99.28278",
   "lat": 53.15889,
   "lon": -99.28278,
   "height_m": 30.0,
   "height_origin": "Assumed",
   "description": "GRAND RAPIDS 230 KV, MANITOBA"
  },
  "site_b": {
   "id": "ised-fixed-53.16333,-99.28806",
   "lat": 53.16333,
   "lon": -99.28806,
   "height_m": 30.0,
   "height_origin": "Assumed",
   "description": "GRAND RAPIDS, MANITOBA"
  },
  "frequency_ghz": 7.72,
  "frequency_origin": "Observed",
  "polarization": "V",
  "polarization_origin": "Assumed",
  "fade_margin_db": 32.0,
  "fade_margin_origin": "Assumed"
 },
 "terrain": {
  "mode": "samples",
  "source": "SYNTHETIC: 100 m flat + triangular hump",
  "hump_m": 25.682,
  "target_percent_fresnel_clear": 2.0,
  "samples": [
   [
    53.15889,
    -99.28278,
    100.0
   ],
   [
    53.158980615,
    -99.282887744,
    101.048245
   ],
   [
    53.159071229,
    -99.282995489,
    102.09649
   ],
   [
    53.159161843,
    -99.283103234,
    103.144735
   ],
   [
    53.159252458,
    -99.283210979,
    104.19298
   ],
   [
    53.159343072,
    -99.283318725,
    105.241224
   ],
   [
    53.159433686,
    -99.283426472,
    106.289469
   ],
   [
    53.1595243,
    -99.283534219,
    107.337714
   ],
   [
    53.159614914,
    -99.283641966,
    108.385959
   ],
   [
    53.159705528,
    -99.283749714,
    109.434204
   ],
   [
    53.159796141,
    -99.283857462,
    110.482449
   ],
   [
    53.159886755,
    -99.283965211,
    111.530694
   ],
   [
    53.159977369,
    -99.28407296,
    112.578939
   ],
   [
    53.160067982,
    -99.28418071,
    113.627184
   ],
   [
    53.160158595,
    -99.28428846,
    114.675429
   ],
   [
    53.160249208,
    -99.284396211,
    115.723673
   ],
   [
    53.160339822,
    -99.284503962,
    116.771918
   ],
   [
    53.160430435,
    -99.284611713,
    117.820163
   ],
   [
    53.160521048,
    -99.284719465,
    118.868408
   ],
   [
    53.16061166,
    -99.284827217,
    119.916653
   ],
   [
    53.160702273,
    -99.28493497,
    120.964898
   ],
   [
    53.160792886,
    -99.285042723,
    122.013143
   ],
   [
    53.160883498,
    -99.285150477,
    123.061388
   ],
   [
    53.160974111,
    -99.285258231,
    124.109633
   ],
   [
    53.161064723,
    -99.285365986,
    125.157878
   ],
   [
    53.161155335,
    -99.285473741,
    125.157878
   ],
   [
    53.161245947,
    -99.285581497,
    124.109633
   ],
   [
    53.161336559,
    -99.285689253,
    123.061388
   ],
   [
    53.161427171,
    -99.285797009,
    122.013143
   ],
   [
    53.161517783,
    -99.285904766,
    120.964898
   ],
   [
    53.161608395,
    -99.286012523,
    119.916653
   ],
   [
    53.161699007,
    -99.286120281,
    118.868408
   ],
   [
    53.161789618,
    -99.28622804,
    117.820163
   ],
   [
    53.16188023,
    -99.286335798,
    116.771918
   ],
   [
    53.161970841,
    -99.286443557,
    115.723673
   ],
   [
    53.162061452,
    -99.286551317,
    114.675429
   ],
   [
    53.162152064,
    -99.286659077,
    113.627184
   ],
   [
    53.162242675,
    -99.286766838,
    112.578939
   ],
   [
    53.162333286,
    -99.286874599,
    111.530694
   ],
   [
    53.162423897,
    -99.28698236,
    110.482449
   ],
   [
    53.162514507,
    -99.287090122,
    109.434204
   ],
   [
    53.162605118,
    -99.287197885,
    108.385959
   ],
   [
    53.162695729,
    -99.287305647,
    107.337714
   ],
   [
    53.162786339,
    -99.287413411,
    106.289469
   ],
   [
    53.162876949,
    -99.287521174,
    105.241224
   ],
   [
    53.16296756,
    -99.287628939,
    104.19298
   ],
   [
    53.16305817,
    -99.287736703,
    103.144735
   ],
   [
    53.16314878,
    -99.287844468,
    102.09649
   ],
   [
    53.16323939,
    -99.287952234,
    101.048245
   ],
   [
    53.16333,
    -99.28806,
    100.0
   ]
  ]
 },
 "weather": {
  "mode": "snapshot",
  "source": "SYNTHETIC raw Open-Meteo `current` object (units: mm per `interval` s; snowfall cm)",
  "sites": {
   "A": {
    "open_meteo_current": {
     "time": "2026-10-07T15:45",
     "interval": 900,
     "temperature_2m": 8.0,
     "wind_speed_10m": 12.0,
     "precipitation": 0.0,
     "rain": 0.0,
     "showers": 0.0,
     "snowfall": 0.0,
     "weather_code": 1
    }
   },
   "B": {
    "open_meteo_current": {
     "time": "2026-10-07T15:45",
     "interval": 900,
     "temperature_2m": 8.0,
     "wind_speed_10m": 12.0,
     "precipitation": 0.0,
     "rain": 0.0,
     "showers": 0.0,
     "snowfall": 0.0,
     "weather_code": 1
    }
   }
  }
 },
 "synthetic": [
  "fade_margin_db",
  "polarization",
  "terrain",
  "weather"
 ]
}