{
 "schema": "velorona.parity-fixture/1",
 "id": "ca-freezing",
 "tags": [
  "freezing"
 ],
 "note": "WMO 66 light freezing rain; neither product reads weather_code",
 "selection": {
  "rule": "see parity/README.md#how-links-were-chosen",
  "pack": "ca-ised-fixed",
  "snapshot_sha256": "f9daa05e51a38a8083d50513d63c7c173caa1ffd5257011af54aed11ce1387c8",
  "link_id": "010764378-002",
  "licensee": "Videotron Ltd. dba Freedom Mobile",
  "published_frequencies_mhz": [
   75375.0,
   85375.0
  ]
 },
 "link": {
  "site_a": {
   "id": "ised-fixed-48.43053,-123.36399",
   "lat": 48.43053,
   "lon": -123.36399,
   "height_m": 30.0,
   "height_origin": "Assumed",
   "description": "Victoria, BC. 1803 Douglas Street"
  },
  "site_b": {
   "id": "ised-fixed-48.43780,-123.36499",
   "lat": 48.4378,
   "lon": -123.36499,
   "height_m": 30.0,
   "height_origin": "Assumed",
   "description": "Victoria, BC. 2638 Ross Lane"
  },
  "frequency_ghz": 85.375,
  "frequency_origin": "Observed",
  "polarization": "V",
  "polarization_origin": "Assumed",
  "fade_margin_db": 1.74,
  "fade_margin_origin": "Assumed"
 },
 "terrain": {
  "mode": "samples",
  "source": "SYNTHETIC: 100 m flat + triangular hump",
  "hump_m": 29.344,
  "target_percent_fresnel_clear": 1.5,
  "samples": [
   [
    48.43053,
    -123.36399,
    100.0
   ],
   [
    48.430678367,
    -123.364010405,
    101.197714
   ],
   [
    48.430826735,
    -123.364030811,
    102.395429
   ],
   [
    48.430975102,
    -123.364051216,
    103.593143
   ],
   [
    48.43112347,
    -123.364071622,
    104.790857
   ],
   [
    48.431271837,
    -123.364092028,
    105.988571
   ],
   [
    48.431420205,
    -123.364112434,
    107.186286
   ],
   [
    48.431568572,
    -123.36413284,
    108.384
   ],
   [
    48.431716939,
    -123.364153246,
    109.581714
   ],
   [
    48.431865307,
    -123.364173652,
    110.779429
   ],
   [
    48.432013674,
    -123.364194058,
    111.977143
   ],
   [
    48.432162042,
    -123.364214465,
    113.174857
   ],
   [
    48.432310409,
    -123.364234872,
    114.372571
   ],
   [
    48.432458776,
    -123.364255278,
    115.570286
   ],
   [
    48.432607144,
    -123.364275685,
    116.768
   ],
   [
    48.432755511,
    -123.364296092,
    117.965714
   ],
   [
    48.432903879,
    -123.364316499,
    119.163429
   ],
   [
    48.433052246,
    -123.364336906,
    120.361143
   ],
   [
    48.433200613,
    -123.364357314,
    121.558857
   ],
   [
    48.433348981,
    -123.364377721,
    122.756571
   ],
   [
    48.433497348,
    -123.364398129,
    123.954286
   ],
   [
    48.433645715,
    -123.364418536,
    125.152
   ],
   [
    48.433794083,
    -123.364438944,
    126.349714
   ],
   [
    48.43394245,
    -123.364459352,
    127.547429
   ],
   [
    48.434090817,
    -123.36447976,
    128.745143
   ],
   [
    48.434239185,
    -123.364500168,
    128.745143
   ],
   [
    48.434387552,
    -123.364520577,
    127.547429
   ],
   [
    48.434535919,
    -123.364540985,
    126.349714
   ],
   [
    48.434684287,
    -123.364561394,
    125.152
   ],
   [
    48.434832654,
    -123.364581802,
    123.954286
   ],
   [
    48.434981021,
    -123.364602211,
    122.756571
   ],
   [
    48.435129389,
    -123.36462262,
    121.558857
   ],
   [
    48.435277756,
    -123.364643029,
    120.361143
   ],
   [
    48.435426123,
    -123.364663438,
    119.163429
   ],
   [
    48.435574491,
    -123.364683847,
    117.965714
   ],
   [
    48.435722858,
    -123.364704257,
    116.768
   ],
   [
    48.435871225,
    -123.364724666,
    115.570286
   ],
   [
    48.436019593,
    -123.364745076,
    114.372571
   ],
   [
    48.43616796,
    -123.364765485,
    113.174857
   ],
   [
    48.436316327,
    -123.364785895,
    111.977143
   ],
   [
    48.436464695,
    -123.364806305,
    110.779429
   ],
   [
    48.436613062,
    -123.364826715,
    109.581714
   ],
   [
    48.436761429,
    -123.364847125,
    108.384
   ],
   [
    48.436909796,
    -123.364867536,
    107.186286
   ],
   [
    48.437058164,
    -123.364887946,
    105.988571
   ],
   [
    48.437206531,
    -123.364908357,
    104.790857
   ],
   [
    48.437354898,
    -123.364928767,
    103.593143
   ],
   [
    48.437503265,
    -123.364949178,
    102.395429
   ],
   [
    48.437651633,
    -123.364969589,
    101.197714
   ],
   [
    48.4378,
    -123.36499,
    100.0
   ]
  ]
 },
 "weather": {
  "mode": "snapshot",
  "source": "SYNTHETIC raw Open-Meteo `current` object (units: mm per `interval` s; snowfall cm)",
  "sites": {
   "A": {
    "open_meteo_current": {
     "time": "2026-10-07T15:45",
     "interval": 900,
     "temperature_2m": 8.0,
     "wind_speed_10m": 12.0,
     "precipitation": 1.2,
     "rain": 1.2,
     "showers": 0.0,
     "snowfall": 0.0,
     "weather_code": 66
    }
   },
   "B": {
    "open_meteo_current": {
     "time": "2026-10-07T15:45",
     "interval": 900,
     "temperature_2m": 8.0,
     "wind_speed_10m": 12.0,
     "precipitation": 1.2,
     "rain": 1.2,
     "showers": 0.0,
     "snowfall": 0.0,
     "weather_code": 66
    }
   }
  }
 },
 "synthetic": [
  "fade_margin_calibrated",
  "fade_margin_db",
  "polarization",
  "terrain",
  "weather"
 ]
}