{
 "schema": "velorona.parity-fixture/1",
 "id": "ca-near-threshold",
 "tags": [
  "near-threshold",
  "D2-near"
 ],
 "note": "Kearns->Kirkland Lake ON; clear by 0.05 of a Fresnel radius",
 "selection": {
  "rule": "see parity/README.md#how-links-were-chosen",
  "pack": "ca-ised-fixed",
  "snapshot_sha256": "f9daa05e51a38a8083d50513d63c7c173caa1ffd5257011af54aed11ce1387c8",
  "link_id": "010102971-004",
  "licensee": "Backhaul Network Services Inc.",
  "published_frequencies_mhz": [
   6034.15,
   6093.45,
   6286.19,
   6345.49
  ]
 },
 "link": {
  "site_a": {
   "id": "ised-fixed-48.13633,-79.55375",
   "lat": 48.13633,
   "lon": -79.55375,
   "height_m": 30.0,
   "height_origin": "Assumed",
   "description": "Kearns, ON (Highway 66)"
  },
  "site_b": {
   "id": "ised-fixed-48.14583,-80.06639",
   "lat": 48.14583,
   "lon": -80.06639,
   "height_m": 30.0,
   "height_origin": "Assumed",
   "description": "KIRKLAND LAKE(HWY 11/MACASSA LN) ON"
  },
  "frequency_ghz": 6.34549,
  "frequency_origin": "Observed",
  "polarization": "V",
  "polarization_origin": "Assumed",
  "fade_margin_db": 32.0,
  "fade_margin_origin": "Assumed"
 },
 "terrain": {
  "mode": "samples",
  "source": "SYNTHETIC: 100 m flat + triangular hump",
  "hump_m": 38.315,
  "target_percent_fresnel_clear": 0.65,
  "samples": [
   [
    48.13633,
    -79.55375,
    100.0
   ],
   [
    48.136546661,
    -79.564210072,
    101.563878
   ],
   [
    48.136762374,
    -79.574670231,
    103.127755
   ],
   [
    48.136977137,
    -79.585130479,
    104.691633
   ],
   [
    48.137190951,
    -79.595590814,
    106.25551
   ],
   [
    48.137403816,
    -79.606051235,
    107.819388
   ],
   [
    48.137615731,
    -79.616511744,
    109.383265
   ],
   [
    48.137826698,
    -79.626972338,
    110.947143
   ],
   [
    48.138036715,
    -79.637433018,
    112.51102
   ],
   [
    48.138245783,
    -79.647893784,
    114.074898
   ],
   [
    48.138453902,
    -79.658354635,
    115.638776
   ],
   [
    48.138661072,
    -79.66881557,
    117.202653
   ],
   [
    48.138867293,
    -79.679276589,
    118.766531
   ],
   [
    48.139072564,
    -79.689737693,
    120.330408
   ],
   [
    48.139276886,
    -79.700198879,
    121.894286
   ],
   [
    48.139480258,
    -79.710660149,
    123.458163
   ],
   [
    48.139682682,
    -79.721121502,
    125.022041
   ],
   [
    48.139884156,
    -79.731582937,
    126.585918
   ],
   [
    48.14008468,
    -79.742044453,
    128.149796
   ],
   [
    48.140284256,
    -79.752506052,
    129.713673
   ],
   [
    48.140482881,
    -79.762967731,
    131.277551
   ],
   [
    48.140680558,
    -79.773429491,
    132.841429
   ],
   [
    48.140877285,
    -79.783891332,
    134.405306
   ],
   [
    48.141073063,
    -79.794353252,
    135.969184
   ],
   [
    48.141267891,
    -79.804815253,
    137.533061
   ],
   [
    48.14146177,
    -79.815277332,
    137.533061
   ],
   [
    48.1416547,
    -79.82573949,
    135.969184
   ],
   [
    48.14184668,
    -79.836201727,
    134.405306
   ],
   [
    48.14203771,
    -79.846664042,
    132.841429
   ],
   [
    48.142227791,
    -79.857126434,
    131.277551
   ],
   [
    48.142416923,
    -79.867588904,
    129.713673
   ],
   [
    48.142605105,
    -79.87805145,
    128.149796
   ],
   [
    48.142792337,
    -79.888514074,
    126.585918
   ],
   [
    48.14297862,
    -79.898976773,
    125.022041
   ],
   [
    48.143163954,
    -79.909439548,
    123.458163
   ],
   [
    48.143348338,
    -79.919902398,
    121.894286
   ],
   [
    48.143531772,
    -79.930365324,
    120.330408
   ],
   [
    48.143714257,
    -79.940828324,
    118.766531
   ],
   [
    48.143895792,
    -79.951291398,
    117.202653
   ],
   [
    48.144076377,
    -79.961754546,
    115.638776
   ],
   [
    48.144256013,
    -79.972217767,
    114.074898
   ],
   [
    48.144434699,
    -79.982681061,
    112.51102
   ],
   [
    48.144612436,
    -79.993144428,
    110.947143
   ],
   [
    48.144789223,
    -80.003607868,
    109.383265
   ],
   [
    48.14496506,
    -80.014071379,
    107.819388
   ],
   [
    48.145139947,
    -80.024534962,
    106.25551
   ],
   [
    48.145313885,
    -80.034998616,
    104.691633
   ],
   [
    48.145486873,
    -80.04546234,
    103.127755
   ],
   [
    48.145658911,
    -80.055926135,
    101.563878
   ],
   [
    48.14583,
    -80.06639,
    100.0
   ]
  ]
 },
 "weather": {
  "mode": "snapshot",
  "source": "SYNTHETIC raw Open-Meteo `current` object (units: mm per `interval` s; snowfall cm)",
  "sites": {
   "A": {
    "open_meteo_current": {
     "time": "2026-10-07T15:45",
     "interval": 900,
     "temperature_2m": 8.0,
     "wind_speed_10m": 12.0,
     "precipitation": 0.0,
     "rain": 0.0,
     "showers": 0.0,
     "snowfall": 0.0,
     "weather_code": 1
    }
   },
   "B": {
    "open_meteo_current": {
     "time": "2026-10-07T15:45",
     "interval": 900,
     "temperature_2m": 8.0,
     "wind_speed_10m": 12.0,
     "precipitation": 0.0,
     "rain": 0.0,
     "showers": 0.0,
     "snowfall": 0.0,
     "weather_code": 1
    }
   }
  }
 },
 "synthetic": [
  "fade_margin_db",
  "polarization",
  "terrain",
  "weather"
 ]
}