{
 "schema": "velorona.parity-fixture/1",
 "id": "ca-long",
 "tags": [
  "long"
 ],
 "note": "203 km, record frequency",
 "selection": {
  "rule": "see parity/README.md#how-links-were-chosen",
  "pack": "ca-ised-fixed",
  "snapshot_sha256": "f9daa05e51a38a8083d50513d63c7c173caa1ffd5257011af54aed11ce1387c8",
  "link_id": "010040755-001",
  "licensee": "Hydro-Qu\u00e9bec",
  "published_frequencies_mhz": [
   1902.0,
   1970.0,
   2146.0,
   2214.0
  ]
 },
 "link": {
  "site_a": {
   "id": "ised-fixed-51.98478,-65.65433",
   "lat": 51.98478,
   "lon": -65.65433,
   "height_m": 30.0,
   "height_origin": "Assumed",
   "description": "Rivi\u00e8re-Nipissis, QC (Eric T.)"
  },
  "site_b": {
   "id": "ised-fixed-53.58811,-64.20200",
   "lat": 53.58811,
   "lon": -64.202,
   "height_m": 30.0,
   "height_origin": "Assumed",
   "description": "LOGAN, LABRADOR NEWFOUNDLAND"
  },
  "frequency_ghz": 2.214,
  "frequency_origin": "Observed",
  "polarization": "V",
  "polarization_origin": "Assumed",
  "fade_margin_db": 32.0,
  "fade_margin_origin": "Assumed"
 },
 "terrain": {
  "mode": "samples",
  "source": "SYNTHETIC: 100 m flat + triangular hump",
  "hump_m": 541.084,
  "target_percent_fresnel_clear": 1.3,
  "samples": [
   [
    51.98478,
    -65.65433,
    100.0
   ],
   [
    52.017674537,
    -65.625740305,
    122.085061
   ],
   [
    52.050562144,
    -65.597108539,
    144.170122
   ],
   [
    52.083442802,
    -65.568434599,
    166.255184
   ],
   [
    52.116316494,
    -65.539718383,
    188.340245
   ],
   [
    52.149183199,
    -65.510959786,
    210.425306
   ],
   [
    52.182042901,
    -65.482158704,
    232.510367
   ],
   [
    52.214895579,
    -65.453315035,
    254.595429
   ],
   [
    52.247741216,
    -65.424428672,
    276.68049
   ],
   [
    52.280579793,
    -65.395499512,
    298.765551
   ],
   [
    52.313411291,
    -65.36652745,
    320.850612
   ],
   [
    52.34623569,
    -65.33751238,
    342.935673
   ],
   [
    52.379052973,
    -65.308454196,
    365.020735
   ],
   [
    52.411863119,
    -65.279352794,
    387.105796
   ],
   [
    52.44466611,
    -65.250208066,
    409.190857
   ],
   [
    52.477461927,
    -65.221019906,
    431.275918
   ],
   [
    52.51025055,
    -65.191788208,
    453.36098
   ],
   [
    52.54303196,
    -65.162512864,
    475.446041
   ],
   [
    52.575806138,
    -65.133193767,
    497.531102
   ],
   [
    52.608573065,
    -65.103830809,
    519.616163
   ],
   [
    52.641332721,
    -65.074423882,
    541.701224
   ],
   [
    52.674085086,
    -65.044972878,
    563.786286
   ],
   [
    52.70683014,
    -65.015477689,
    585.871347
   ],
   [
    52.739567865,
    -64.985938205,
    607.956408
   ],
   [
    52.772298241,
    -64.956354317,
    630.041469
   ],
   [
    52.805021247,
    -64.926725916,
    630.041469
   ],
   [
    52.837736864,
    -64.897052892,
    607.956408
   ],
   [
    52.870445072,
    -64.867335135,
    585.871347
   ],
   [
    52.903145851,
    -64.837572533,
    563.786286
   ],
   [
    52.935839181,
    -64.807764978,
    541.701224
   ],
   [
    52.968525041,
    -64.777912356,
    519.616163
   ],
   [
    53.001203412,
    -64.748014558,
    497.531102
   ],
   [
    53.033874274,
    -64.718071471,
    475.446041
   ],
   [
    53.066537605,
    -64.688082982,
    453.36098
   ],
   [
    53.099193387,
    -64.658048981,
    431.275918
   ],
   [
    53.131841597,
    -64.627969354,
    409.190857
   ],
   [
    53.164482216,
    -64.597843988,
    387.105796
   ],
   [
    53.197115223,
    -64.56767277,
    365.020735
   ],
   [
    53.229740598,
    -64.537455587,
    342.935673
   ],
   [
    53.262358319,
    -64.507192323,
    320.850612
   ],
   [
    53.294968367,
    -64.476882866,
    298.765551
   ],
   [
    53.32757072,
    -64.446527099,
    276.68049
   ],
   [
    53.360165356,
    -64.41612491,
    254.595429
   ],
   [
    53.392752256,
    -64.385676181,
    232.510367
   ],
   [
    53.425331399,
    -64.355180798,
    210.425306
   ],
   [
    53.457902762,
    -64.324638645,
    188.340245
   ],
   [
    53.490466325,
    -64.294049606,
    166.255184
   ],
   [
    53.523022066,
    -64.263413563,
    144.170122
   ],
   [
    53.555569965,
    -64.2327304,
    122.085061
   ],
   [
    53.58811,
    -64.202,
    100.0
   ]
  ]
 },
 "weather": {
  "mode": "snapshot",
  "source": "SYNTHETIC raw Open-Meteo `current` object (units: mm per `interval` s; snowfall cm)",
  "sites": {
   "A": {
    "open_meteo_current": {
     "time": "2026-10-07T15:45",
     "interval": 900,
     "temperature_2m": 8.0,
     "wind_speed_10m": 12.0,
     "precipitation": 0.0,
     "rain": 0.0,
     "showers": 0.0,
     "snowfall": 0.0,
     "weather_code": 1
    }
   },
   "B": {
    "open_meteo_current": {
     "time": "2026-10-07T15:45",
     "interval": 900,
     "temperature_2m": 8.0,
     "wind_speed_10m": 12.0,
     "precipitation": 0.0,
     "rain": 0.0,
     "showers": 0.0,
     "snowfall": 0.0,
     "weather_code": 1
    }
   }
  }
 },
 "synthetic": [
  "fade_margin_db",
  "polarization",
  "terrain",
  "weather"
 ]
}